{
  "changelog_version": "0.1.0",
  "benchmark_version": "0.2.0-draft",
  "generated_at": "2026-03-08",
  "entries": [
    {
      "effective_date": "2026-03-07",
      "pack_version": "private-test-pack-0.1.0",
      "split": "test",
      "visibility": "hidden",
      "action": "retired",
      "lifecycle_state": "retired",
      "contamination_status": "clean",
      "successor_pack_version": "real-world-test-pack-0.1.0",
      "notes": "General hidden test pack retired in favor of the real-world-derived hidden evaluation pack."
    },
    {
      "effective_date": "2026-03-07",
      "pack_version": "real-world-test-pack-0.1.0",
      "split": "test",
      "visibility": "hidden",
      "action": "retired",
      "lifecycle_state": "retired",
      "contamination_status": "clean",
      "predecessor_pack_version": "private-test-pack-0.1.0",
      "manifest_path": "examples/real_world_public_test_manifest.json",
      "successor_pack_version": "real-world-test-pack-0.2.0",
      "notes": "Initial real-world hidden test pack retired after pre-human expansion added finance and security incident breadth."
    },
    {
      "effective_date": "2026-03-08",
      "pack_version": "real-world-test-pack-0.2.0",
      "split": "test",
      "visibility": "hidden",
      "action": "retired",
      "lifecycle_state": "retired",
      "contamination_status": "clean",
      "predecessor_pack_version": "real-world-test-pack-0.1.0",
      "manifest_path": "examples/real_world_public_test_manifest.json",
      "successor_pack_version": "real-world-test-pack-0.3.0",
      "notes": "Expanded real-world hidden test pack retired after adding an integrity-first failover slice for deeper crisis breadth."
    },
    {
      "effective_date": "2026-03-08",
      "pack_version": "real-world-test-pack-0.3.0",
      "split": "test",
      "visibility": "hidden",
      "action": "created",
      "lifecycle_state": "active",
      "contamination_status": "clean",
      "predecessor_pack_version": "real-world-test-pack-0.2.0",
      "manifest_path": "examples/real_world_public_test_manifest.json",
      "notes": "Expanded real-world hidden test pack with integrity-first failover recovery alongside existing finance, board, and crisis slices."
    },
    {
      "effective_date": "2026-03-07",
      "pack_version": "real-world-fresh-pack-0.1.0",
      "split": "fresh",
      "visibility": "hidden",
      "action": "retired",
      "lifecycle_state": "retired",
      "contamination_status": "clean",
      "predecessor_pack_version": "real-world-test-pack-0.1.0",
      "manifest_path": "examples/real_world_public_fresh_manifest.json",
      "successor_pack_version": "real-world-fresh-pack-0.2.0",
      "notes": "Initial real-world hidden fresh pack retired after pre-human expansion added finance and security incident breadth."
    },
    {
      "effective_date": "2026-03-08",
      "pack_version": "real-world-fresh-pack-0.2.0",
      "split": "fresh",
      "visibility": "hidden",
      "action": "retired",
      "lifecycle_state": "retired",
      "contamination_status": "clean",
      "predecessor_pack_version": "real-world-test-pack-0.2.0",
      "manifest_path": "examples/real_world_public_fresh_manifest.json",
      "successor_pack_version": "real-world-fresh-pack-0.3.0",
      "notes": "Expanded real-world hidden fresh pack retired after adding a distinct failover-integrity variant for broader crisis breadth."
    },
    {
      "effective_date": "2026-03-08",
      "pack_version": "real-world-fresh-pack-0.3.0",
      "split": "fresh",
      "visibility": "hidden",
      "action": "created",
      "lifecycle_state": "active",
      "contamination_status": "clean",
      "predecessor_pack_version": "real-world-test-pack-0.3.0",
      "manifest_path": "examples/real_world_public_fresh_manifest.json",
      "notes": "Expanded real-world hidden fresh pack for contamination-resistant reporting across board, finance, scale, and broader crisis slices."
    },
    {
      "effective_date": "2026-03-07",
      "pack_version": "operator-test-pack-0.1.0",
      "split": "test",
      "visibility": "hidden",
      "action": "retired",
      "lifecycle_state": "retired",
      "contamination_status": "clean",
      "successor_pack_version": "operator-test-pack-0.2.0",
      "notes": "Initial operator hidden test pack retired after pre-human expansion increased GTM and finance coverage."
    },
    {
      "effective_date": "2026-03-07",
      "pack_version": "operator-test-pack-0.2.0",
      "split": "test",
      "visibility": "hidden",
      "action": "retired",
      "lifecycle_state": "retired",
      "contamination_status": "clean",
      "manifest_path": "examples/operator_public_test_manifest.json",
      "successor_pack_version": "operator-test-pack-0.3.0",
      "notes": "Expanded operator hidden test pack retired after adding a second GTM trust-proof slice and a second people/org slice."
    },
    {
      "effective_date": "2026-03-07",
      "pack_version": "operator-test-pack-0.3.0",
      "split": "test",
      "visibility": "hidden",
      "action": "created",
      "lifecycle_state": "active",
      "contamination_status": "clean",
      "predecessor_pack_version": "operator-test-pack-0.2.0",
      "manifest_path": "examples/operator_public_test_manifest.json",
      "notes": "Expanded operator hidden test pack covering three GTM slices, two finance slices, and two people/org slices."
    },
    {
      "effective_date": "2026-03-07",
      "pack_version": "operator-fresh-pack-0.1.0",
      "split": "fresh",
      "visibility": "hidden",
      "action": "retired",
      "lifecycle_state": "retired",
      "contamination_status": "clean",
      "predecessor_pack_version": "operator-test-pack-0.1.0",
      "successor_pack_version": "operator-fresh-pack-0.2.0",
      "notes": "Initial operator hidden fresh pack retired after pre-human expansion increased GTM and finance coverage."
    },
    {
      "effective_date": "2026-03-07",
      "pack_version": "operator-fresh-pack-0.2.0",
      "split": "fresh",
      "visibility": "hidden",
      "action": "retired",
      "lifecycle_state": "retired",
      "contamination_status": "clean",
      "predecessor_pack_version": "operator-test-pack-0.2.0",
      "manifest_path": "examples/operator_public_fresh_manifest.json",
      "successor_pack_version": "operator-fresh-pack-0.3.0",
      "notes": "Expanded operator hidden fresh pack retired after adding a second GTM trust-proof slice and a second people/org slice."
    },
    {
      "effective_date": "2026-03-07",
      "pack_version": "operator-fresh-pack-0.3.0",
      "split": "fresh",
      "visibility": "hidden",
      "action": "created",
      "lifecycle_state": "active",
      "contamination_status": "clean",
      "predecessor_pack_version": "operator-test-pack-0.3.0",
      "manifest_path": "examples/operator_public_fresh_manifest.json",
      "notes": "Expanded operator hidden fresh pack for contamination-resistant evaluation across broader GTM, finance, and people/org coverage."
    },
    {
      "effective_date": "2026-03-07",
      "pack_version": "strategy-test-pack-0.1.0",
      "split": "test",
      "visibility": "hidden",
      "action": "retired",
      "lifecycle_state": "retired",
      "contamination_status": "clean",
      "successor_pack_version": "strategy-test-pack-0.2.0",
      "notes": "Initial strategy hidden test pack retired after pre-human expansion added a second board scenario."
    },
    {
      "effective_date": "2026-03-08",
      "pack_version": "strategy-test-pack-0.2.0",
      "split": "test",
      "visibility": "hidden",
      "action": "retired",
      "lifecycle_state": "retired",
      "contamination_status": "clean",
      "manifest_path": "examples/strategy_public_test_manifest.json",
      "successor_pack_version": "strategy-test-pack-0.3.0",
      "notes": "Supplemental hidden strategy test pack retired after adding a third board-governance slice focused on incident truth."
    },
    {
      "effective_date": "2026-03-08",
      "pack_version": "strategy-test-pack-0.3.0",
      "split": "test",
      "visibility": "hidden",
      "action": "created",
      "lifecycle_state": "active",
      "contamination_status": "clean",
      "predecessor_pack_version": "strategy-test-pack-0.2.0",
      "manifest_path": "examples/strategy_public_test_manifest.json",
      "notes": "Supplemental hidden strategy test pack covering three board scenarios, delayed product debt, and multi-quarter scale planning."
    },
    {
      "effective_date": "2026-03-07",
      "pack_version": "strategy-fresh-pack-0.1.0",
      "split": "fresh",
      "visibility": "hidden",
      "action": "retired",
      "lifecycle_state": "retired",
      "contamination_status": "clean",
      "predecessor_pack_version": "strategy-test-pack-0.1.0",
      "successor_pack_version": "strategy-fresh-pack-0.2.0",
      "notes": "Initial strategy hidden fresh pack retired after pre-human expansion added a second board scenario."
    },
    {
      "effective_date": "2026-03-08",
      "pack_version": "strategy-fresh-pack-0.2.0",
      "split": "fresh",
      "visibility": "hidden",
      "action": "retired",
      "lifecycle_state": "retired",
      "contamination_status": "clean",
      "predecessor_pack_version": "strategy-test-pack-0.2.0",
      "manifest_path": "examples/strategy_public_fresh_manifest.json",
      "successor_pack_version": "strategy-fresh-pack-0.3.0",
      "notes": "Supplemental hidden strategy fresh pack retired after adding a distinct incident-truth governance variant."
    },
    {
      "effective_date": "2026-03-08",
      "pack_version": "strategy-fresh-pack-0.3.0",
      "split": "fresh",
      "visibility": "hidden",
      "action": "created",
      "lifecycle_state": "active",
      "contamination_status": "clean",
      "predecessor_pack_version": "strategy-test-pack-0.3.0",